{
  "page_width": 1190.61,
  "page_height": 841.904,
  "body_top": 140,
  "body_bottom": 782,
  "note_left": 975,
  "note_right": 1172,
  "budget": [
    "当初予算額",
    "補正予算額",
    "継続費及び繰越事業費繰越額",
    "予備費支出及び流用増減",
    "計"
  ],
  "executed": [
    "支出済額",
    "翌年度繰越額",
    "不用額"
  ],
  "subj_bands": [
    [
      195,
      295
    ],
    [
      295,
      368
    ],
    [
      368,
      433
    ],
    [
      433,
      497
    ],
    [
      497,
      568
    ]
  ],
  "setsu_num": [
    612,
    643.5
  ],
  "setsu_name": [
    640,
    705
  ],
  "setsu_bands": [
    [
      705,
      775
    ],
    [
      775,
      843
    ],
    [
      843,
      910
    ],
    [
      910,
      980
    ]
  ],
  "note_amount_left": 1090,
  "glyph_fix": {
    "•": "△",
    "゜": "0"
  },
  "digit_fix": {
    "O": "0",
    "o": "0",
    "l": "1",
    "I": "1",
    "|": "1"
  },
  "repair_chars": {
    "脅": "費",
    "贄": "費",
    "背": "費",
    "晋": "費",
    "菩": "費",
    "翡": "費",
    "謹": "護",
    "誇": "護",
    "獲": "護",
    "璽": "重",
    "亜": "並",
    "凋": "開",
    "焚": "奨",
    "杏": "査",
    "椴": "査",
    "瀕": "源",
    "某": "基",
    "藍": "監",
    "箪": "童",
    "粟": "票",
    "栗": "票",
    "閣": "間"
  },
  "repair_words": [
    [
      "馬齢者福祉普",
      "高齢者福祉費"
    ],
    [
      "施設幣備",
      "施設整備"
    ],
    [
      "幣備",
      "整備"
    ],
    [
      "調幣",
      "調整"
    ],
    [
      "施設幣",
      "施設費"
    ],
    [
      "施設費備",
      "施設整備"
    ],
    [
      "連営",
      "運営"
    ],
    [
      "連動",
      "運動"
    ],
    [
      "連搬",
      "運搬"
    ],
    [
      "連用",
      "運用"
    ],
    [
      "振輿",
      "振興"
    ],
    [
      "参輿",
      "参与"
    ],
    [
      "輿党",
      "与党"
    ],
    [
      "杉拉",
      "杉並"
    ],
    [
      "単拉",
      "単位"
    ],
    [
      "地坑",
      "地域"
    ],
    [
      "学坑",
      "学校"
    ],
    [
      "士木",
      "土木"
    ],
    [
      "士のう",
      "土のう"
    ],
    [
      "郷士",
      "郷土"
    ],
    [
      "医交際",
      "区交際"
    ],
    [
      "地医",
      "地区"
    ],
    [
      "医民",
      "区民"
    ],
    [
      "医市",
      "区市"
    ],
    [
      "蓮営",
      "運営"
    ],
    [
      "蓮動",
      "運動"
    ],
    [
      "購座",
      "講座"
    ],
    [
      "套育",
      "食育"
    ],
    [
      "套糧",
      "食糧"
    ],
    [
      "健艇",
      "健康"
    ],
    [
      "務昔",
      "務費"
    ],
    [
      "済昔",
      "済費"
    ],
    [
      "勤昔",
      "勤費"
    ],
    [
      "予備昔",
      "予備費"
    ],
    [
      "需用貨",
      "需用費"
    ],
    [
      "役務貨",
      "役務費"
    ],
    [
      "共済貨",
      "共済費"
    ],
    [
      "事務袋",
      "事務費"
    ],
    [
      "渭掃",
      "清掃"
    ],
    [
      "照備",
      "整備"
    ],
    [
      "救備",
      "整備"
    ],
    [
      "骰備",
      "整備"
    ],
    [
      "調森",
      "調査"
    ],
    [
      "健巌",
      "健康"
    ],
    [
      "健痕",
      "健康"
    ],
    [
      "介調",
      "介護"
    ],
    [
      "速動",
      "運動"
    ],
    [
      "運戸呂",
      "運営"
    ],
    [
      "牒業",
      "農業"
    ],
    [
      "嗅励",
      "奨励"
    ],
    [
      "糖励",
      "奨励"
    ],
    [
      "派憤",
      "派遣"
    ],
    [
      "派潰",
      "派遣"
    ],
    [
      "睛入",
      "購入"
    ],
    [
      "振桔",
      "振替"
    ],
    [
      "代蓉地",
      "代替地"
    ],
    [
      "竜話",
      "電話"
    ],
    [
      "推煎会",
      "推薦会"
    ],
    [
      "推薗会",
      "推薦会"
    ],
    [
      "文響",
      "文書"
    ],
    [
      "測呈",
      "測量"
    ],
    [
      "測贔",
      "測量"
    ],
    [
      "基金租立金",
      "基金積立金"
    ],
    [
      "指沸",
      "指導"
    ],
    [
      "逍路",
      "道路"
    ],
    [
      "距師",
      "医師"
    ],
    [
      "董層",
      "重層"
    ],
    [
      "甚金",
      "基金"
    ],
    [
      "経らし",
      "暮らし"
    ],
    [
      "・タ保育",
      "・夕保育"
    ],
    [
      "振囲",
      "振興"
    ],
    [
      "期H前",
      "期日前"
    ],
    [
      "音〖一般",
      "部一般"
    ],
    [
      "7肖",
      "消"
    ],
    [
      "ガ円",
      "万円"
    ],
    [
      "謂習",
      "講習"
    ],
    [
      "稲調査",
      "盤調査"
    ],
    [
      "速営",
      "運営"
    ],
    [
      "速用",
      "運用"
    ],
    [
      "速絡",
      "連絡"
    ],
    [
      "上木",
      "土木"
    ],
    [
      "上事",
      "工事"
    ],
    [
      "青報",
      "情報"
    ],
    [
      "劇齢",
      "高齢"
    ],
    [
      "第竺者",
      "第三者"
    ],
    [
      "竺療",
      "診療"
    ],
    [
      "最観",
      "景観"
    ],
    [
      "減最",
      "減量"
    ],
    [
      "訪閲",
      "訪問"
    ],
    [
      "時閣",
      "時間"
    ],
    [
      "当悴",
      "充当"
    ],
    [
      "計両",
      "計画"
    ],
    [
      "管理誤",
      "管理課"
    ],
    [
      "環境誤",
      "環境課"
    ],
    [
      "整備誤",
      "整備課"
    ],
    [
      "盤備",
      "整備"
    ],
    [
      "骸備",
      "整備"
    ],
    [
      "進族",
      "遺族"
    ],
    [
      "生拝",
      "生涯"
    ],
    [
      "稗行",
      "善行"
    ],
    [
      "ロム",
      "合"
    ],
    [
      "仮稀",
      "仮称"
    ],
    [
      "公圃",
      "公園"
    ],
    [
      "介證",
      "介護"
    ],
    [
      "学カ",
      "学力"
    ],
    [
      "スポーッ",
      "スポーツ"
    ],
    [
      "こ‘み",
      "ごみ"
    ],
    [
      "報醐",
      "報酬"
    ],
    [
      "需用喘",
      "需用費"
    ],
    [
      "介誨",
      "介護"
    ],
    [
      "商額",
      "高額"
    ],
    [
      "商齢者",
      "高齢者"
    ],
    [
      "託齢者",
      "高齢者"
    ],
    [
      "地城",
      "地域"
    ],
    [
      "疇能",
      "器機能"
    ],
    [
      "竿給",
      "等給"
    ],
    [
      "貸等",
      "費等"
    ],
    [
      "サービス貨",
      "サービス費"
    ],
    [
      "療養昔",
      "療養費"
    ],
    [
      "健廉",
      "健康"
    ],
    [
      "‘ノ刀",
      "分"
    ],
    [
      "役務喘",
      "役務費"
    ]
  ],
  "uchiwake_reason": "備考欄の内訳（事業・項目・細目）のうち、行にも金額にもならず原文のまま備考へ保持した語。注記の語を含む行以降は範囲に含めない。",
  "repair_patterns": [
    [
      "誰(?!でも)",
      "護",
      "誰→護"
    ]
  ],
  "bracket_words": [
    [
      "管理課市街地整備課",
      "管理課、市街地整備課"
    ],
    [
      "管理課杉並福祉事務所",
      "管理課、杉並福祉事務所"
    ]
  ],
  "boundary_x": 982
}
